{
  "release_id": "AIGC-REL-5C632BB7E4D1ACD1",
  "created_at": "2026-07-03T04:29:21.400429+00:00",
  "phase": "phase18_scaling_productization",
  "version": "0.18.0-milestone-r",
  "status": "internal_release_candidate",
  "release_type": "internal_private_kernel",
  "branch": "codex/milestone-l-truth-first-procurement-governance",
  "commit": "e6507c3",
  "required_files_present": true,
  "missing_required_files": [],
  "checked_files": [
    {
      "path": "AGENTS.md",
      "present": true,
      "kind": "file"
    },
    {
      "path": "AIGC_MASTER_PROMPT.md",
      "present": true,
      "kind": "file"
    },
    {
      "path": "OMEGA_X_CONSTITUTION.md",
      "present": true,
      "kind": "file"
    },
    {
      "path": "LICENSE",
      "present": true,
      "kind": "file"
    },
    {
      "path": "README.md",
      "present": true,
      "kind": "file"
    },
    {
      "path": ".github/workflows/aigc-ci.yml",
      "present": true,
      "kind": "file"
    },
    {
      "path": "prompts/phase22_quantum_quality_kernel.md",
      "present": true,
      "kind": "file"
    },
    {
      "path": "prompts/phase23_ascended_work_order_governor.md",
      "present": true,
      "kind": "file"
    },
    {
      "path": "prompts/phase24_truthful_procurement_process.md",
      "present": true,
      "kind": "file"
    },
    {
      "path": "prompts/phase25_continuous_intelligence_ingestion.md",
      "present": true,
      "kind": "file"
    },
    {
      "path": "prompts/phase26_ascended_capability_procurement.md",
      "present": true,
      "kind": "file"
    },
    {
      "path": "prompts/phase27_stale_artifact_renewal.md",
      "present": true,
      "kind": "file"
    },
    {
      "path": "prompts/phase28_fresh_candidate_regeneration.md",
      "present": true,
      "kind": "file"
    },
    {
      "path": "prompts/phase29_operator_freshness_review_procurement.md",
      "present": true,
      "kind": "file"
    },
    {
      "path": "prompts/phase30_omni_agent_cloud_intelligence.md",
      "present": true,
      "kind": "file"
    },
    {
      "path": "config/phase10_connector_registry.json",
      "present": true,
      "kind": "file"
    },
    {
      "path": "config/phase11_security_config.json",
      "present": true,
      "kind": "file"
    },
    {
      "path": "config/phase14_runtime_engine.json",
      "present": true,
      "kind": "file"
    },
    {
      "path": "config/phase17_incident_response.json",
      "present": true,
      "kind": "file"
    },
    {
      "path": "config/phase20_fidelity_forge.json",
      "present": true,
      "kind": "file"
    },
    {
      "path": "config/phase21_customer_satisfaction_continuum.json",
      "present": true,
      "kind": "file"
    },
    {
      "path": "config/phase22_quantum_quality_kernel.json",
      "present": true,
      "kind": "file"
    },
    {
      "path": "config/phase23_work_order_governor.json",
      "present": true,
      "kind": "file"
    },
    {
      "path": "config/phase24_procurement_governance.json",
      "present": true,
      "kind": "file"
    },
    {
      "path": "config/phase25_continuous_intelligence_ingestion.json",
      "present": true,
      "kind": "file"
    },
    {
      "path": "config/phase26_capability_procurement.json",
      "present": true,
      "kind": "file"
    },
    {
      "path": "config/phase27_stale_artifact_renewal.json",
      "present": true,
      "kind": "file"
    },
    {
      "path": "config/phase28_regeneration_controller.json",
      "present": true,
      "kind": "file"
    },
    {
      "path": "config/phase29_freshness_review_procurement.json",
      "present": true,
      "kind": "file"
    },
    {
      "path": "config/phase30_omni_agent_cloud_intelligence.json",
      "present": true,
      "kind": "file"
    },
    {
      "path": "schemas/connector_record.schema.json",
      "present": true,
      "kind": "file"
    },
    {
      "path": "schemas/customer_satisfaction_record.schema.json",
      "present": true,
      "kind": "file"
    },
    {
      "path": "schemas/fidelity_review.schema.json",
      "present": true,
      "kind": "file"
    },
    {
      "path": "schemas/productization_release_record.schema.json",
      "present": true,
      "kind": "file"
    },
    {
      "path": "schemas/quality_kernel_record.schema.json",
      "present": true,
      "kind": "file"
    },
    {
      "path": "schemas/procurement_record.schema.json",
      "present": true,
      "kind": "file"
    },
    {
      "path": "schemas/intelligence_ingestion_record.schema.json",
      "present": true,
      "kind": "file"
    },
    {
      "path": "schemas/capability_procurement_record.schema.json",
      "present": true,
      "kind": "file"
    },
    {
      "path": "schemas/stale_artifact_renewal_record.schema.json",
      "present": true,
      "kind": "file"
    },
    {
      "path": "schemas/regeneration_candidate_record.schema.json",
      "present": true,
      "kind": "file"
    },
    {
      "path": "schemas/freshness_review_record.schema.json",
      "present": true,
      "kind": "file"
    },
    {
      "path": "schemas/omni_agent_architecture_record.schema.json",
      "present": true,
      "kind": "file"
    },
    {
      "path": "schemas/subagent_team_plan.schema.json",
      "present": true,
      "kind": "file"
    },
    {
      "path": "schemas/work_order_governance_record.schema.json",
      "present": true,
      "kind": "file"
    },
    {
      "path": "src/aigc.py",
      "present": true,
      "kind": "file"
    },
    {
      "path": "src/core/contract_validator.py",
      "present": true,
      "kind": "file"
    },
    {
      "path": "src/core/phase_registry.py",
      "present": true,
      "kind": "file"
    },
    {
      "path": "src/core/state_store.py",
      "present": true,
      "kind": "file"
    },
    {
      "path": "src/phase10_connector_registry.py",
      "present": true,
      "kind": "file"
    },
    {
      "path": "src/phase17_incident_response.py",
      "present": true,
      "kind": "file"
    },
    {
      "path": "src/phase18_productization.py",
      "present": true,
      "kind": "file"
    },
    {
      "path": "src/phase19_subagent_forge.py",
      "present": true,
      "kind": "file"
    },
    {
      "path": "src/phase20_fidelity_forge.py",
      "present": true,
      "kind": "file"
    },
    {
      "path": "src/phase21_customer_satisfaction_continuum.py",
      "present": true,
      "kind": "file"
    },
    {
      "path": "src/phase22_quantum_quality_kernel.py",
      "present": true,
      "kind": "file"
    },
    {
      "path": "src/phase23_work_order_governor.py",
      "present": true,
      "kind": "file"
    },
    {
      "path": "src/phase24_procurement_governance.py",
      "present": true,
      "kind": "file"
    },
    {
      "path": "src/phase25_continuous_intelligence_ingestion.py",
      "present": true,
      "kind": "file"
    },
    {
      "path": "src/phase26_capability_procurement.py",
      "present": true,
      "kind": "file"
    },
    {
      "path": "src/phase27_stale_artifact_renewal.py",
      "present": true,
      "kind": "file"
    },
    {
      "path": "src/phase28_regeneration_controller.py",
      "present": true,
      "kind": "file"
    },
    {
      "path": "src/phase29_freshness_review_procurement.py",
      "present": true,
      "kind": "file"
    },
    {
      "path": "src/phase30_omni_agent_cloud_intelligence.py",
      "present": true,
      "kind": "file"
    },
    {
      "path": "docs/PRIVATE_BRANCH_WORKFLOW.md",
      "present": true,
      "kind": "file"
    }
  ],
  "validation_commands": [
    "python .\\src\\aigc.py validate",
    "python -m pytest",
    "python .\\src\\security\\redaction_scanner.py --paths src config docs README.md AGENTS.md AIGC_MASTER_PROMPT.md OMEGA_X_CONSTITUTION.md schemas tests reports prompts"
  ],
  "manual_release_gates": [
    "confirm_github_repo_private",
    "confirm_all_rights_reserved_notice_present",
    "confirm_no_raw_secrets_in_release",
    "confirm_ci_green_on_main",
    "confirm_operator_approval_before_public_distribution",
    "confirm_no_live_external_connectors_enabled"
  ],
  "forbidden_productization_behaviors": [
    "publish_public_release_without_operator_approval",
    "deploy_runtime_without_phase14_preflight",
    "enable_live_connectors_without_phase5_approval",
    "package_raw_secrets",
    "package_local_sqlite_memory",
    "package_approval_tokens",
    "weaken_all_rights_reserved_notice",
    "disable_ci_or_local_git_guards"
  ],
  "release_artifacts": [
    "data/phase18_productization/aigc_phase18_release_readiness.json",
    "data/reports/phase18_signature_update.md",
    "data/phase22_quality/aigc_phase22_quality_kernel_records.json",
    "data/reports/phase22_signature_update.md",
    "data/phase23_work_orders/aigc_phase23_work_order_governance_records.json",
    "data/reports/phase23_signature_update.md",
    "data/phase24_procurement/aigc_phase24_procurement_records.json",
    "data/reports/phase24_signature_update.md",
    "data/phase25_intelligence/aigc_phase25_intelligence_ingestion_records.json",
    "data/reports/phase25_signature_update.md",
    "data/phase26_capability_procurement/aigc_phase26_capability_procurement_records.json",
    "data/reports/phase26_signature_update.md",
    "data/phase27_renewal/aigc_phase27_stale_artifact_renewal_records.json",
    "data/reports/phase27_signature_update.md",
    "data/phase28_regeneration/aigc_phase28_regeneration_candidates.json",
    "data/reports/phase28_signature_update.md",
    "data/phase29_freshness_reviews/aigc_phase29_freshness_review_records.json",
    "data/reports/phase29_signature_update.md",
    "data/phase30_omni_agent_cloud/aigc_phase30_omni_agent_architecture_records.json",
    "data/reports/phase30_signature_update.md",
    "reports/milestone_f_productization_report.md",